{
  "speciesId": "magnet",
  "displayName": "Magnet",
  "sdkVersion": "1.0.0",
  "modelAsset": "model/magnet_v2_runtime.glb",
  "sharedFace": "shared/face/push_face_outline.svg",
  "coreMeshes": [
    "head",
    "body",
    "arm_L",
    "arm_R",
    "hand_L",
    "hand_R",
    "leg_L",
    "leg_R",
    "foot_L",
    "foot_R",
    "face_frame",
    "face_screen"
  ],
  "extraMeshes": [
    "magnet_arm_L",
    "magnet_arm_R",
    "floating_bolt_0",
    "floating_bolt_1",
    "floating_nut_0"
  ],
  "anchors": "anchors.json",
  "materials": "materials.json",
  "mastery": "mastery.json"
}