{
  "speciesId": "replace_me",
  "displayName": "Replace Me",
  "sdkVersion": "1.0.0",
  "modelAsset": "model/replace_me.glb",
  "sharedFace": "shared/face/push_face_outline.svg",
  "coreMeshes": [
    "head",
    "body",
    "arm_L",
    "arm_R",
    "hand_L",
    "hand_R",
    "leg_L",
    "leg_R",
    "foot_L",
    "foot_R",
    "face_frame",
    "face_screen"
  ],
  "extraMeshes": [],
  "anchors": "anchors.json",
  "materials": "materials.json",
  "mastery": "mastery.json"
}