{
  "speciesId": "heart",
  "displayName": "Heart",
  "sdkVersion": "1.0.0",
  "modelAsset": "model/heart.glb",
  "sharedFace": "shared/face/push_face_outline.svg",
  "coreMeshes": [
    "head",
    "body",
    "arm_L",
    "arm_R",
    "hand_L",
    "hand_R",
    "leg_L",
    "leg_R",
    "foot_L",
    "foot_R",
    "face_frame",
    "face_screen"
  ],
  "extraMeshes": [
    "wing_L",
    "wing_R",
    "heart_chest",
    "heart_orb_L",
    "heart_orb_R",
    "heart_orb_top",
    "halo_left",
    "halo_right",
    "aura_trail_L",
    "aura_trail_R"
  ],
  "anchors": "anchors.json",
  "materials": "materials.json",
  "mastery": "mastery.json"
}