{
  "speciesId": "hopper",
  "displayName": "Hopper",
  "sdkVersion": "1.0.0",
  "modelAsset": "model/hopper.glb",
  "sharedFace": "shared/face/push_face_outline.svg",
  "coreMeshes": [
    "head",
    "body",
    "arm_L",
    "arm_R",
    "hand_L",
    "hand_R",
    "leg_L",
    "leg_R",
    "foot_L",
    "foot_R",
    "face_frame",
    "face_screen"
  ],
  "extraMeshes": [
    "belly_patch",
    "ear_L",
    "ear_R",
    "inner_ear_L",
    "inner_ear_R",
    "portal_ring_0",
    "portal_ring_1",
    "portal_ring_2",
    "portal_core",
    "portal_particle_0",
    "portal_particle_1",
    "portal_particle_2",
    "portal_particle_3"
  ],
  "anchors": "anchors.json",
  "materials": "materials.json",
  "mastery": "mastery.json"
}