{
  "speciesId": "thorn",
  "displayName": "Thorn",
  "sdkVersion": "1.0.0",
  "modelAsset": "model/thorn.glb",
  "sharedFace": "shared/face/push_face_outline.svg",
  "coreMeshes": [
    "head",
    "body",
    "arm_L",
    "arm_R",
    "hand_L",
    "hand_R",
    "leg_L",
    "leg_R",
    "foot_L",
    "foot_R",
    "face_frame",
    "face_screen"
  ],
  "extraMeshes": [
    "leaf_head_L",
    "leaf_head_R",
    "leaf_shoulder_L",
    "leaf_shoulder_R",
    "thorn_head_0",
    "thorn_head_1",
    "thorn_back_0",
    "thorn_arm_L",
    "thorn_arm_R",
    "flower_0",
    "flower_1",
    "flower_2"
  ],
  "anchors": "anchors.json",
  "materials": "materials.json",
  "mastery": "mastery.json"
}