{
  "speciesId": "hoarder",
  "displayName": "Hoarder",
  "sdkVersion": "1.0.0",
  "modelAsset": "model/hoarder.glb",
  "sharedFace": "shared/face/push_face_outline.svg",
  "coreMeshes": [
    "head",
    "body",
    "arm_L",
    "arm_R",
    "hand_L",
    "hand_R",
    "leg_L",
    "leg_R",
    "foot_L",
    "foot_R",
    "face_frame",
    "face_screen"
  ],
  "extraMeshes": [
    "bag_main",
    "bag_side_L",
    "bag_side_R",
    "strap_L",
    "strap_R",
    "item_blue_0",
    "item_red_0",
    "item_gold_0",
    "item_blue_1",
    "item_red_1",
    "organizer_slot_0",
    "organizer_slot_1",
    "organizer_slot_2"
  ],
  "anchors": "anchors.json",
  "materials": "materials.json",
  "mastery": "mastery.json"
}