{
  "speciesId": "glow",
  "displayName": "Glow",
  "sdkVersion": "1.0.0",
  "modelAsset": "model/glow.glb",
  "sharedFace": "shared/face/push_face_outline.svg",
  "coreMeshes": [
    "head",
    "body",
    "arm_L",
    "arm_R",
    "hand_L",
    "hand_R",
    "leg_L",
    "leg_R",
    "foot_L",
    "foot_R",
    "face_frame",
    "face_screen"
  ],
  "extraMeshes": [
    "crystal_head_0",
    "crystal_head_1",
    "crystal_head_2",
    "crystal_shoulder_L",
    "crystal_shoulder_R",
    "crystal_back_0",
    "crystal_back_1",
    "crystal_back_2",
    "glow_orb_0",
    "glow_orb_1",
    "glow_orb_2",
    "crystal_chest"
  ],
  "anchors": "anchors.json",
  "materials": "materials.json",
  "mastery": "mastery.json"
}