{
  "speciesId": "shell",
  "displayName": "Shell",
  "sdkVersion": "1.0.0",
  "modelAsset": "model/shell.glb",
  "sharedFace": "shared/face/push_face_outline.svg",
  "coreMeshes": [
    "head",
    "body",
    "arm_L",
    "arm_R",
    "hand_L",
    "hand_R",
    "leg_L",
    "leg_R",
    "foot_L",
    "foot_R",
    "face_frame",
    "face_screen"
  ],
  "extraMeshes": [
    "shell_core",
    "shell_ridge_top",
    "shell_ridge_mid",
    "shell_ridge_low",
    "shell_side_L",
    "shell_side_R",
    "shell_glow_0",
    "shell_glow_1",
    "shell_glow_2",
    "shell_glow_3",
    "shell_spike_0",
    "shell_spike_1",
    "shell_spike_2",
    "shell_spike_3"
  ],
  "anchors": "anchors.json",
  "materials": "materials.json",
  "mastery": "mastery.json"
}