{
  "speciesId": "chroma",
  "displayName": "Chroma",
  "sdkVersion": "1.0.0",
  "modelAsset": "model/chroma.glb",
  "sharedFace": "shared/face/push_face_outline.svg",
  "coreMeshes": [
    "head",
    "body",
    "arm_L",
    "arm_R",
    "hand_L",
    "hand_R",
    "leg_L",
    "leg_R",
    "foot_L",
    "foot_R",
    "face_frame",
    "face_screen"
  ],
  "extraMeshes": [
    "crest_0",
    "crest_1",
    "crest_2",
    "tail_base",
    "tail_tip",
    "patch_L",
    "patch_R",
    "patch_chest"
  ],
  "anchors": "anchors.json",
  "materials": "materials.json",
  "mastery": "mastery.json"
}